{
  "$schema": "https://json-schema.org/draft/2020-12/schema",
  "$id": "https://github.com/apet97/plaky115/openapi/upstream-manifest.schema.json",
  "title": "Plaky115 accepted upstream OpenAPI provenance",
  "type": "object",
  "additionalProperties": false,
  "required": [
    "sourceUrl",
    "requestedUrl",
    "finalUrl",
    "redirectChain",
    "fetchedAt",
    "httpStatus",
    "contentType",
    "rawSha256",
    "canonicalSha256",
    "info",
    "operationCount",
    "methodPathKeys",
    "acceptedAt",
    "acceptedSha256"
  ],
  "properties": {
    "sourceUrl": { "type": "string", "minLength": 1 },
    "requestedUrl": { "type": "string", "minLength": 1 },
    "finalUrl": { "type": "string", "minLength": 1 },
    "redirectChain": {
      "type": "array",
      "items": {
        "type": "object",
        "additionalProperties": false,
        "required": ["from", "to", "status"],
        "properties": {
          "from": { "type": "string", "minLength": 1 },
          "to": { "type": "string", "minLength": 1 },
          "status": { "type": "integer", "minimum": 300, "maximum": 399 }
        }
      }
    },
    "fetchedAt": { "type": "string", "format": "date-time" },
    "httpStatus": { "type": "integer", "minimum": 200, "maximum": 299 },
    "contentType": { "type": "string", "minLength": 1 },
    "rawSha256": { "type": "string", "pattern": "^[a-f0-9]{64}$" },
    "canonicalSha256": { "type": "string", "pattern": "^[a-f0-9]{64}$" },
    "info": {
      "type": "object",
      "additionalProperties": false,
      "required": ["title", "version"],
      "properties": {
        "title": { "type": ["string", "null"] },
        "version": { "type": ["string", "null"] }
      }
    },
    "operationCount": { "type": "integer", "minimum": 0 },
    "methodPathKeys": {
      "type": "array",
      "uniqueItems": true,
      "items": { "type": "string", "pattern": "^(GET|PUT|POST|DELETE|PATCH|OPTIONS|HEAD|TRACE) /" }
    },
    "acceptedAt": { "type": "string", "format": "date-time" },
    "acceptedSha256": { "type": "string", "pattern": "^[a-f0-9]{64}$" }
  }
}
