{
  "sourceUrl": "https://docs.plaky.com/",
  "requestedUrl": "https://docs.plaky.com/",
  "finalUrl": "https://docs.plaky.com/",
  "redirectChain": [],
  "fetchedAt": "2026-09-06T08:15:06.584Z",
  "httpStatus": 200,
  "contentType": "text/html; charset=utf-8",
  "rawSha256": "e03c50ed74fcf994d670ff1eb9167f3fe437e2e83935def5bc1798f73c06984f",
  "canonicalSha256": "0aa047cec4b45908b428eff54f5e6b16de1b306486a2ac182eda3b8ddb9bb5c2",
  "info": {
    "title": "Plaky API",
    "version": "v1"
  },
  "operationCount": 32,
  "methodPathKeys": [
    "DELETE /v1/public/spaces/{spaceId}/boards/{boardId}/item-groups/{itemGroupId}",
    "DELETE /v1/public/spaces/{spaceId}/boards/{boardId}/items/{itemId}",
    "DELETE /v1/public/spaces/{spaceId}/boards/{boardId}/items/{itemId}/comments/{itemCommentId}",
    "DELETE /v1/public/spaces/{spaceId}/boards/{boardId}/items/{itemId}/files/{itemFileId}",
    "GET /v1/public/spaces",
    "GET /v1/public/spaces/{spaceId}",
    "GET /v1/public/spaces/{spaceId}/boards",
    "GET /v1/public/spaces/{spaceId}/boards/{boardId}",
    "GET /v1/public/spaces/{spaceId}/boards/{boardId}/item-groups",
    "GET /v1/public/spaces/{spaceId}/boards/{boardId}/item-groups/{itemGroupId}",
    "GET /v1/public/spaces/{spaceId}/boards/{boardId}/items",
    "GET /v1/public/spaces/{spaceId}/boards/{boardId}/items/{itemId}",
    "GET /v1/public/spaces/{spaceId}/boards/{boardId}/items/{itemId}/comments",
    "GET /v1/public/spaces/{spaceId}/boards/{boardId}/items/{itemId}/files",
    "GET /v1/public/spaces/{spaceId}/boards/{boardId}/items/{itemId}/files/{itemFileId}",
    "GET /v1/public/spaces/{spaceId}/boards/{boardId}/items/{itemId}/files/{itemFileId}/download",
    "GET /v1/public/spaces/{spaceId}/boards/{boardId}/items/{itemId}/sub-items",
    "GET /v1/public/teams",
    "GET /v1/public/teams/{teamId}",
    "GET /v1/public/users",
    "GET /v1/public/users/me",
    "PATCH /v1/public/spaces/{spaceId}/boards/{boardId}/items/{itemId}/fields",
    "PATCH /v1/public/spaces/{spaceId}/boards/{boardId}/items/{itemId}/fields/{itemFieldKey}",
    "POST /v1/public/spaces/{spaceId}/boards/{boardId}/item-groups",
    "POST /v1/public/spaces/{spaceId}/boards/{boardId}/items",
    "POST /v1/public/spaces/{spaceId}/boards/{boardId}/items/{itemId}/comments",
    "POST /v1/public/spaces/{spaceId}/boards/{boardId}/items/{itemId}/files",
    "PUT /v1/public/spaces/{spaceId}/boards/{boardId}/item-groups/{itemGroupId}",
    "PUT /v1/public/spaces/{spaceId}/boards/{boardId}/item-groups/{itemGroupId}/archive",
    "PUT /v1/public/spaces/{spaceId}/boards/{boardId}/items/{itemId}/comments/{itemCommentId}",
    "PUT /v1/public/spaces/{spaceId}/boards/{boardId}/items/{itemId}/comments/{itemCommentId}/reactions",
    "PUT /v1/public/spaces/{spaceId}/boards/{boardId}/items/{itemId}/files/{itemFileId}"
  ],
  "acceptedAt": "2026-09-06T08:16:11.142Z",
  "acceptedSha256": "fe3e5bac33564ecd11e4d4d7c8172904883abd967b56500e946db3df2415c1b7"
}
